{
  "schemaVersion": 1,
  "recordType": "lekh-experimental-passive-commit-policy",
  "id": "lekh-experimental-passive-commit-v1",
  "sourceContract": {
    "id": "lekh-token-candidates-v1",
    "path": "data/engine/lekh-token-candidates.v1.json",
    "sha256": "cdaf7b070a09b04b0f6e6b696603082243d3bcacd94e88633ceb65c464bd43f2",
    "canonicalJsonSha256": "6dd2024bdbb925ff44e2974bbea28598a72ec4b40a51d885a81f5a6947bdb9b3"
  },
  "productionEligible": false,
  "activation": "opaque-test-build-capability-only",
  "policy": "exact-single-output-repository-contract",
  "notes": "Explicit experimental Space-commit authorization. This is not probability calibration or production-gold evidence; production release remains blocked until human-rated calibration and undo validation exist.",
  "normalization": "NFC-lowercase-ascii-input",
  "delimiter": " ",
  "minimumConfidence": 0.92,
  "minimumInputCodePoints": 4,
  "evidenceRequirements": {
    "humanRatedSamplesPerEntry": 100,
    "maximumAmbiguityRate": 0.005,
    "maximumUndoRate": 0.005,
    "requiredNegativeCorpora": ["english", "names", "mixed-language"]
  },
  "entries": [
    { "input": "mero", "output": "मेरो", "evidence": { "provenance": "repository-curated-contract", "humanRatedSamples": 0, "observedAmbiguityRate": null, "observedUndoRate": null } },
    { "input": "malai", "output": "मलाई", "evidence": { "provenance": "repository-curated-contract", "humanRatedSamples": 0, "observedAmbiguityRate": null, "observedUndoRate": null } },
    { "input": "timi", "output": "तिमी", "evidence": { "provenance": "repository-curated-contract", "humanRatedSamples": 0, "observedAmbiguityRate": null, "observedUndoRate": null } },
    { "input": "timro", "output": "तिम्रो", "evidence": { "provenance": "repository-curated-contract", "humanRatedSamples": 0, "observedAmbiguityRate": null, "observedUndoRate": null } },
    { "input": "tapai", "output": "तपाईं", "evidence": { "provenance": "repository-curated-contract", "humanRatedSamples": 0, "observedAmbiguityRate": null, "observedUndoRate": null } },
    { "input": "hami", "output": "हामी", "evidence": { "provenance": "repository-curated-contract", "humanRatedSamples": 0, "observedAmbiguityRate": null, "observedUndoRate": null } },
    { "input": "hamro", "output": "हाम्रो", "evidence": { "provenance": "repository-curated-contract", "humanRatedSamples": 0, "observedAmbiguityRate": null, "observedUndoRate": null } },
    { "input": "naam", "output": "नाम", "evidence": { "provenance": "repository-curated-contract", "humanRatedSamples": 0, "observedAmbiguityRate": null, "observedUndoRate": null } },
    { "input": "chha", "output": "छ", "evidence": { "provenance": "repository-curated-contract", "humanRatedSamples": 0, "observedAmbiguityRate": null, "observedUndoRate": null } },
    { "input": "hoina", "output": "होइन", "evidence": { "provenance": "repository-curated-contract", "humanRatedSamples": 0, "observedAmbiguityRate": null, "observedUndoRate": null } },
    { "input": "chaina", "output": "छैन", "evidence": { "provenance": "repository-curated-contract", "humanRatedSamples": 0, "observedAmbiguityRate": null, "observedUndoRate": null } },
    { "input": "huncha", "output": "हुन्छ", "evidence": { "provenance": "repository-curated-contract", "humanRatedSamples": 0, "observedAmbiguityRate": null, "observedUndoRate": null } },
    { "input": "garna", "output": "गर्न", "evidence": { "provenance": "repository-curated-contract", "humanRatedSamples": 0, "observedAmbiguityRate": null, "observedUndoRate": null } },
    { "input": "garne", "output": "गर्ने", "evidence": { "provenance": "repository-curated-contract", "humanRatedSamples": 0, "observedAmbiguityRate": null, "observedUndoRate": null } },
    { "input": "gardai", "output": "गर्दै", "evidence": { "provenance": "repository-curated-contract", "humanRatedSamples": 0, "observedAmbiguityRate": null, "observedUndoRate": null } },
    { "input": "gareko", "output": "गरेको", "evidence": { "provenance": "repository-curated-contract", "humanRatedSamples": 0, "observedAmbiguityRate": null, "observedUndoRate": null } },
    { "input": "bhayo", "output": "भयो", "evidence": { "provenance": "repository-curated-contract", "humanRatedSamples": 0, "observedAmbiguityRate": null, "observedUndoRate": null } },
    { "input": "aaja", "output": "आज", "evidence": { "provenance": "repository-curated-contract", "humanRatedSamples": 0, "observedAmbiguityRate": null, "observedUndoRate": null } },
    { "input": "bholi", "output": "भोलि", "evidence": { "provenance": "repository-curated-contract", "humanRatedSamples": 0, "observedAmbiguityRate": null, "observedUndoRate": null } },
    { "input": "hijo", "output": "हिजो", "evidence": { "provenance": "repository-curated-contract", "humanRatedSamples": 0, "observedAmbiguityRate": null, "observedUndoRate": null } },
    { "input": "ghar", "output": "घर", "evidence": { "provenance": "repository-curated-contract", "humanRatedSamples": 0, "observedAmbiguityRate": null, "observedUndoRate": null } },
    { "input": "awastha", "output": "अवस्था", "evidence": { "provenance": "repository-curated-contract", "humanRatedSamples": 0, "observedAmbiguityRate": null, "observedUndoRate": null } },
    { "input": "khana", "output": "खाना", "evidence": { "provenance": "repository-curated-contract", "humanRatedSamples": 0, "observedAmbiguityRate": null, "observedUndoRate": null } },
    { "input": "ramro", "output": "राम्रो", "evidence": { "provenance": "repository-curated-contract", "humanRatedSamples": 0, "observedAmbiguityRate": null, "observedUndoRate": null } },
    { "input": "swasthya", "output": "स्वास्थ्य", "evidence": { "provenance": "repository-curated-contract", "humanRatedSamples": 0, "observedAmbiguityRate": null, "observedUndoRate": null } },
    { "input": "dhanyabad", "output": "धन्यवाद", "evidence": { "provenance": "repository-curated-contract", "humanRatedSamples": 0, "observedAmbiguityRate": null, "observedUndoRate": null } },
    { "input": "namaste", "output": "नमस्ते", "evidence": { "provenance": "repository-curated-contract", "humanRatedSamples": 0, "observedAmbiguityRate": null, "observedUndoRate": null } },
    { "input": "thik", "output": "ठीक", "evidence": { "provenance": "repository-curated-contract", "humanRatedSamples": 0, "observedAmbiguityRate": null, "observedUndoRate": null } },
    { "input": "kaam", "output": "काम", "evidence": { "provenance": "repository-curated-contract", "humanRatedSamples": 0, "observedAmbiguityRate": null, "observedUndoRate": null } },
    { "input": "kura", "output": "कुरा", "evidence": { "provenance": "repository-curated-contract", "humanRatedSamples": 0, "observedAmbiguityRate": null, "observedUndoRate": null } },
    { "input": "ahile", "output": "अहिले", "evidence": { "provenance": "repository-curated-contract", "humanRatedSamples": 0, "observedAmbiguityRate": null, "observedUndoRate": null } }
  ]
}
